{
  "$schema": "oebf://schema/0.1/path",
  "id": "path-wall-north-ff",
  "type": "Path",
  "description": "North external wall, first floor",
  "closed": false,
  "segments": [
    {
      "type": "line",
      "start": {
        "x": 0,
        "y": 6.0,
        "z": 3.0
      },
      "end": {
        "x": 9.0,
        "y": 6.0,
        "z": 3.0
      }
    }
  ],
  "tags": [
    "external",
    "ff"
  ]
}
