{
  "$schema": "oebf://schema/0.1/path",
  "id": "path-parapet-south",
  "type": "Path",
  "description": "South parapet",
  "closed": false,
  "segments": [
    {
      "type": "line",
      "start": {
        "x": 9.0,
        "y": 0,
        "z": 6.251999999999999
      },
      "end": {
        "x": 0,
        "y": 0,
        "z": 6.251999999999999
      }
    }
  ],
  "tags": [
    "parapet",
    "roof"
  ]
}
