{
  "$schema": "oebf://schema/0.1/path",
  "id": "path-upstand-west",
  "type": "Path",
  "description": "Masonry upstand under the west external wall",
  "closed": false,
  "segments": [
    {
      "type": "line",
      "start": {
        "x": 0,
        "y": 0,
        "z": -0.12
      },
      "end": {
        "x": 0,
        "y": 6.0,
        "z": -0.12
      }
    }
  ],
  "tags": [
    "upstand",
    "gf"
  ]
}
