{
  "$schema": "oebf://schema/0.1/path",
  "id": "path-column-int-gf",
  "type": "Path",
  "description": "Glulam column int, GF",
  "closed": false,
  "segments": [
    {
      "type": "line",
      "start": {
        "x": 7.32,
        "y": 3.0,
        "z": 0.03
      },
      "end": {
        "x": 7.68,
        "y": 3.0,
        "z": 0.03
      }
    }
  ],
  "tags": [
    "column",
    "gf"
  ]
}
