{
  "$schema": "oebf://schema/0.1/path",
  "id": "path-wall-west-gf",
  "type": "Path",
  "description": "Ground floor west wall centreline — runs south to north",
  "closed": false,
  "segments": [{
    "type": "line",
    "start": { "x": 0.0, "y": 0.0, "z": 0.0 },
    "end":   { "x": 0.0, "y": 8.5, "z": 0.0 }
  }],
  "tags": ["wall", "party", "ground-floor"]
}
