{
  "$schema": "oebf://schema/0.1/path",
  "id": "path-wall-clt-3-gf",
  "type": "Path",
  "description": "Internal CLT wall on grid line 3, ground floor",
  "closed": false,
  "segments": [
    {
      "type": "line",
      "start": {
        "x": 6.0,
        "y": 0,
        "z": 0.03
      },
      "end": {
        "x": 6.0,
        "y": 6.0,
        "z": 0.03
      }
    }
  ],
  "tags": [
    "internal",
    "structure",
    "gf"
  ]
}
