{
  "$schema": "oebf://schema/0.1/path",
  "id": "path-wall-shaft-gf",
  "type": "Path",
  "description": "Riser wall, GF",
  "closed": false,
  "segments": [
    {
      "type": "line",
      "start": {
        "x": 1.5,
        "y": 3.8,
        "z": 0.0
      },
      "end": {
        "x": 1.5,
        "y": 6.0,
        "z": 0.0
      }
    }
  ],
  "tags": [
    "riser",
    "gf"
  ]
}
